{
  "schema_version": 1,
  "reel_id": "reel-b5f51e26",
  "output": {
    "filename": "Reel.mp4",
    "fps": 30,
    "video_codec": "libx264",
    "audio_codec": "aac",
    "size": "1920x1080"
  },
  "style": {
    "font": "DejaVu-Sans-Bold",
    "overlay_bg": "rgba(0,0,0,0.5)",
    "fade_duration": 0.5
  },
  "intro": {
    "text": "",
    "duration": 0.0
  },
  "outro": {
    "text": "",
    "duration": 0.0
  },
  "music": {
    "file": "",
    "volume": 0.15,
    "duck_under_speech": true
  },
  "clips": [],
  "verification": {
    "verdict": "unverifiable",
    "checks": []
  }
}
